124	1	ちばレポ	まーさん	荒屋敷貝塚	千葉市若葉区貝塚町	"　現在の千葉港に注ぐ都川の流域にある台地上には、縄文時代の貝塚が数多く分布している。特にその支流である葭川や坂月川流域に多くみられ、大規模な馬蹄形や環状の貝塚が密集する地域として有名である。
　荒屋敷貝塚は、約5,500年前の縄文時代中期から、約3,500年前の後期にかけてできた貝塚で、北側と南側は、都川に注ぐ小さな川があり、その小川にはさまれた標高約31mの広大な台地上に位置している。貝塚の直径は約160mで、南に向かって開口した、環状に近い馬蹄形貝塚である。ハマグリ、アサリ、キサゴ等の東京湾の干潟でみられた貝類が主体で、なかでも直径1cm以下のイボキサゴが多くみられ、また、イワシをはじめとする魚類の骨も発見され、活発な漁労が営まれていたことがわかる。
　昭和48年（1973）以降、千葉県教育委員会及び千葉県文化財センターによって3次にわたる発掘調査が行われたが、主要な部分は原状のまま保存されている。
　この台地上には、他に草刈場貝塚、台門貝塚など、荒屋敷貝塚と同じ時期の貝塚が多く所在し、「貝塚町貝塚群」とよばれている。また、これらの貝塚との相互の関連から、縄文時代の集落の形態や社会構造を解明するうえで重要な地域となっている。
昭和53年国指定史跡（出典：千葉市教育委員会「市内文化財一覧」）"	撮影年月：2016年10月 分類：歴史、史跡 分野：貝塚		1						1			0124_01_201610	0B1lo0bTHuRacZjJfcnlGVmN6aWc	0124_02_201610	0B1lo0bTHuRacSWNnRk95WmI0UEU											35.62227108	140.1449143	昭和53年	1978	国指定	記念物	史跡
125	1	ちばレポ	まーさん	加曽利貝塚	千葉市若葉区桜木8丁目33	"　千葉県の東京湾岸は、全国一の貝塚密集地帯として知られているが、なかでも加曽利貝塚は、直径約130ｍで環状の北貝塚と、長軸約170ｍで馬蹄形の南貝塚という連接した貝塚からなり、全体としては日本で最大の規模を有する貝塚である。加曽利貝塚には、今から約7,000年前から約2,500年前までの生活の痕跡があるが、巨大な貝塚は、縄文時代中頃の約5,000年前から縄文時代の終わり頃にかけての約2,000年の間に残されたものである。
　加曽利貝塚は日本の縄文時代研究にとっても重要な意味をもっており、昭和46年（1971）に国の史跡に指定された。貝塚は巨大なタイムカプセルで、食糧としたり、道具として利用した魚の骨・動物の骨・植物の残骸など、さらには葬られた人の骨が貝によって守られ、縄文時代の膨大な情報を遺している。
　現在は広大な史跡公園となっており、縄文時代のムラの様子を思わせる復元住居群や捨てられた貝殻の様子を観察できる貝層断面、さらには加曽利貝塚博物館などで縄文時代の生活に触れることができる。
昭和45年国指定史跡（出典：千葉市教育委員会「市内文化財一覧」）"	撮影年月：2016年10月 分類：歴史、史跡 分野：貝塚		1						1			0125_01_201610	0B1lo0bTHuRacbWMwZjc5dFNpT1E	0125_02_201610	0B1lo0bTHuRacMndmX1AzWTdIV2s	0125_03_201610	0B1lo0bTHuRacaUZuRTRMMVRQYk0									35.62434124	140.1630152	昭和45年	1970	国指定	記念物	史跡
126	1	ちばレポ	まーさん	旧大須賀家住宅	千葉市若葉区桜木8丁目33	"旧大須賀家住宅
もと幕張町にあった大須賀家の住宅。昭和43年千葉市に寄贈され、民族資料として保存のため、ここに移築した。
江戸時代、幕張町は天領に属し、北町奉行配下にあり、大須賀家はその代官所にあてられ、俗称「北の代官所」と呼ばれていたという。
この屋敷は、寛保～寛延年間（1741～1750）の建造と思われ、一部に近年の改造の跡がみられる。奥の間は比較的よく旧態を残し、武家風の書院造で、床の間や違棚などに、その特色がみられる。
千葉市立加曽利貝塚博物館
（出典：現地看板）"	撮影年月：2016年10月 分類：歴史、建築 分野：民俗資料									1		0126_01_201610	0B1lo0bTHuRaccVhtVVhfX1ZkTW8													35.62326202	140.1660326
127	1	ちばレポ	まーさん	縄文中期の集落	千葉市若葉区桜木2丁目20	"縄文中期の集落
1970－72年（昭和45－47）の遺跡限界確認調査の結果、かつては北貝塚の内側にだけ存在していると思われていた縄文中期の住居跡が、北貝塚から約200mも離れたこの地点から13戸も集中して発見されました。
そのうちの2戸には、その住居が使われなくなった跡に捨てられてできた貝層（小型貝塚）が発見されました。同じ時期に共存していた北貝塚（大型貝塚）とどのような関係があったのかを考えるため、その中期の一時期である加曽利EⅡ式期の集落をここに復元しました。
（出典：現地看板）"	撮影年月：2016年10月 分類：歴史、史跡、ポケストップ 分野：貝塚 その他：加曽利貝塚内の復原集落	1	1						1			0127_01_201610	0B1lo0bTHuRacV2M3X1BkNkZJRUU	0127_02_201610	0B1lo0bTHuRacdGx4Vm1vTVhEQVE	0127_03_200812	0B1lo0bTHuRacWGE5eUpTRk1UelU									35.62198001	140.1653889
128	1	ちばレポ	まーさん	貝塚の中心部	千葉市若葉区桜木2丁目20	"貝塚の中心部
南貝塚の中心には、貝も捨てず住居趾も少ない広場があり、土偶や石棒や埋葬人骨が集中して発見されています。干貝加工の共同生産では、日当りのいい干場になっていたに違いありません。
そのほか、この中央広場では、この地方からは産出しない硬い石材などと干貝とを交換する共同交易や、むらびとの結婚式、安産の祈り、死者のとむらい、先祖の霊まつりなどの共同祭祀を行う場となっていました。いわば、この地域のむらむらの集いの場であったと考えられます。
（出典：現地看板）"	撮影年月：2016年10月 分類：歴史、史跡、ポケストップ 分野：貝塚 その他：加曽利貝塚・南貝塚	1	1						1			0128_01_201610	0B1lo0bTHuRaceTJDUFYwTWJ2U28													35.62303636	140.1640773
129	8	オープン！ちば	松島	花輪貝塚	千葉市若葉区加曽利町	"　千葉県中央部は、直径100mを超える大型貝塚が多く分布し、わが国においても貝塚の集中地域といえる。花輪貝塚は、都川の北岸の標高約30mの舌状台地に立地している。貝塚の存在は古くから知られていたが、平成15年度の千葉市教育振興財団埋蔵文化財調査センターによる確認調査で全容が明らかとなった。貝塚は直径約120mの環状で、現状でも貝塚に囲まれた台地の中央がややくぼみ、縁辺部が高くなっており、環状に貝塚が形成されている状況が実際に確認できるほど遺存状態は良好である。
　貝塚の形成は縄文時代後期前半（堀之内式期）、今から約4,000年前で、他の貝塚と比べて極めて短期間に環状の貝塚が形成されたようである。貝では、イボキサゴが圧倒的に多く、次いでハマグリ、アサリ、シオフキも多く、汽水産のヤマトシジミは少ない。台地縁辺から斜面部にかけて、貝塚と同時期の竪穴住居跡が29棟確認され、中央広場を取り巻くように環状に分布している。
　花輪貝塚は、縄文時代後期前半の残存状況がきわめて良好な、大規模な環状貝塚であり、当該地域の自然環境や生業のあり方を知る上で重要である。また、貝塚の形成時期が縄文時代後期前半の極めて短い期間に限定される点も大きな特徴であり、当時の集落及び社会のあり方を知る上でも重要な遺跡である。
平成18年国指定史跡（出典：千葉市教育委員会「市内文化財一覧」）"	撮影年月：2016年10月 分類：歴史、史跡 分野：貝塚		1						1			0129_01_201610	0B1lo0bTHuRacVW53MXI1Tm90U2M	0129_02_201610	0B1lo0bTHuRaccDJsRFlXTzE2R1k											35.6147029	140.1602029	平成18年	2006	国指定	記念物	史跡
130	1	ちばレポ	まーさん	月之木貝塚	千葉市中央区仁戸名町	"　月ノ木貝塚は、千葉市の中心部を流れる都川の支流に面した標高約25mの台地上にある。東西150m、南北200mの範囲に貝層が分布する馬蹄形貝塚である。昭和26年（1951）に、千葉市史編さんのために貝塚全体の地形測量と、貝塚の北東部分で約10平方メートルの発掘調査が行われている。
　その当時は北側に開く馬蹄形の貝塚と考えられていたが、平成3年（1991）に千葉市教育委員会によって行われた貝層分布調査で、東側に開く馬蹄形貝塚であることが判明した。月ノ木貝塚の貝層の厚さは1.2～1.5mであるが、中央の広場状の凹地に向かって次第に薄くなり、中央凹地部分には貝や遺物は散布していない。
　昭和26年の発掘調査では、約4,500年前の縄文時代中期の竪穴住居跡が4軒検出され、加曽利E式とよばれる土器とともに、打製石斧や磨製石斧、耳飾りなどが出土している。貝類はハマグリ、キサゴ、アサリ、シオフキなどの内湾の浅い海の砂泥にすむ貝で、同時に鳥、魚、獣の骨やクジラの脊椎骨も出土している。ハマグリはほとんどが小型で、大きなハマグリは取りつくされ、小さいハマグリしか採取できなくなっていたことを物語っている。
昭和52年国指定史跡（出典：千葉市教育委員会「市内文化財一覧」）"	撮影年月：2016年10月 分類：歴史、史跡 分野：貝塚 その他：台地上の貝層部には、地表にイボキサゴなどが散乱しています		1						1			0130_01_201610	0B1lo0bTHuRaca1FfUlpBNC1iNk0	0130_03_201610	0B1lo0bTHuRacSGFQemw4U1BZOWs											35.59503341	140.1570566	昭和52年	1977	国指定	記念物	史跡
131	1	ちばレポ	まーさん	七天王塚	千葉市中央区亥鼻3丁目6	"　千葉大学医学部の敷地内に5基、病院坂の通り沿いに2基合計7基の小塚には、牛頭天王が祀られていることから七天王塚と呼ばれています。ちょうど猪鼻城の辰巳の位置にあたることから、築城に際し、妙見信仰に関係の深い北斗七星を形どって塚を配置し、魔よけとしたものと考えられています。
昭和34年市指定史跡（出典：千葉市教育委員会「市内文化財一覧」）

千葉市文化財　七天王塚
千葉大学医学部構内に散在する七つの古塚は「七天王塚」または「七つ塚」と呼ばれ、古くから疫病・災害を除く神として崇められています。塚の上の古碑に刻まれている「牛頭天王（ごずてんのう）」は千葉氏の守護神の一つで、千学集抄には「千葉の守護神は曽場鷹大明神、堀内牛頭天王云々……」と記されています。このことから千葉氏は、猪鼻城の大手口に崇敬する北斗七星の形に七つの塚を配置して牛頭天王を祀り、一族の繁栄を祈ったものと考えられています。また一説には、この七天王塚は千葉氏の七人の兄弟を葬った墓であるとか、平の将門の「七騎武者」の墓とも伝えられていますが定かではありません。
（出典：現地看板）"	撮影年月：2016年10月 分類：歴史、史跡 分野：塚		1						1			0131_01_201610	0B1lo0bTHuRaceEdLRER3cTR2M1k	0131_02_201610	0B1lo0bTHuRacYlJ5Z3cxOTZsSnc											35.6022567	140.1335484	昭和34年	1959	市指定	記念物	史跡
132	1	ちばレポ	まーさん	七天王塚	千葉市中央区亥鼻1丁目8	"　千葉大学医学部の敷地内に5基、病院坂の通り沿いに2基合計7基の小塚には、牛頭天王が祀られていることから七天王塚と呼ばれています。ちょうど猪鼻城の辰巳の位置にあたることから、築城に際し、妙見信仰に関係の深い北斗七星を形どって塚を配置し、魔よけとしたものと考えられています。
昭和34年市指定史跡（出典：千葉市教育委員会「市内文化財一覧」）

千葉市指定史跡　七天王塚
昭和35年3月指定
医学部構内外に散在するこの七つの古塚は「七天王塚」「七つ塚」と呼ばれ、疫病災害を除く神として崇めらてている。
猪鼻城の大手口に北斗七星の形に配置してあり七つの塚の一つである。
千葉市教育委員会
（出典：現地看板）"	撮影年月：2016年10月  分類：歴史、史跡  分野：塚		1						1			0132_01_201610	0B1lo0bTHuRacR2ZMandwZEdGV1U													35.60238264	140.1337777	昭和34年	1959	市指定	記念物	史跡
133	1	ちばレポ	まーさん	七天王塚	千葉市中央区亥鼻3丁目6	"　千葉大学医学部の敷地内に5基、病院坂の通り沿いに2基合計7基の小塚には、牛頭天王が祀られていることから七天王塚と呼ばれています。ちょうど猪鼻城の辰巳の位置にあたることから、築城に際し、妙見信仰に関係の深い北斗七星を形どって塚を配置し、魔よけとしたものと考えられています。
昭和34年市指定史跡（出典：千葉市教育委員会「市内文化財一覧」）

猪鼻城または千葉城ともいわれる千葉氏の居城があった猪鼻山は、北は都川、西は断崖に面した天険の要害の地で、その大手口にあたる現在の千葉大学医学部構内外には、千葉氏が一族の繁栄を願って作ったといわれる「七天王塚」が残されています。
七つの塚には千葉氏の守護神である牛頭天王（ごずてんのう）が祀られ、これらは千葉氏の崇拝する北斗七星の形に配置されているといわれています。また一説には、この七天王塚は千葉氏の七人の兄弟を葬った墓であるとか、平将門の「七騎武者」の墓とも伝えられています。
（出典：現地看板）"	撮影年月：2016年10月  分類：歴史、史跡  分野：塚		1						1			0133_01_201610	0B1lo0bTHuRacUjl1bDJLYTNaUjQ													35.60263616	140.1327277	昭和34年	1959	市指定	記念物	史跡
134	1	ちばレポ	かおりん	はなちゃんトピアリー	千葉市美浜区高浜7丁目2		分類:モニュメント 分野:トピアリー その他:花の美術館のシンボルです				1							0134_01_201610	0B1lo0bTHuRacb3ZHUXdoLVZZazQ	0134_02_201610	0B1lo0bTHuRacSmlIMkFiMnNRNzQ											35.61856147	140.0642982
135	1	ちばレポ	かおりん	花時計	千葉市美浜区高浜7丁目2		分類:モニュメント 分野:時計 その他:稲毛海浜公園内のシンボル 季節ごとにいろんな花で飾られる時計です				1							0135_01_201610	0B1lo0bTHuRacUDVmYUNrUkRIMm8	0135_02_201610	0B1lo0bTHuRacZUdNbEk5eE15Y0k	0135_03_201610	0B1lo0bTHuRacOEhBT1pSUkRTYTA									35.61825186	140.0644805
136	8	オープン！ちば	松島	幕張稲毛シーサイドランニングコース	千葉市美浜区打瀬3丁目	"千葉市の特色のひとつである豊かな自然と水辺を活かしたランニングコース。心地よい潮風を感じながら、東京湾越しの富士山や幕張新都心の景観を望むことができる快適なコースです。全長は13km。
美浜区豊砂（花見川第2終末処理場前）～海浜大通り～美浜大橋～検見川の浜～稲毛海浜公園（折り返し地点）片道6.5kmとなっています。
（参照：千葉市ホームページ http://www.city.chiba.jp/shimin/seikatsubunka/sports/makuhari-inagerunning.html ）"									1			0136_01_201502	0B1lo0bTHuRacd3l5Y3M0MmtrQnc					0136_01_201502	0B1lo0bTHuRacd3l5Y3M0MmtrQnc				1			35.633201	140.042899
137	8	オープン！ちば	松島	千葉市動物公園											1			0137_01_201603	0B1lo0bTHuRacX0lmbzVFX3ROZGM	0137_02_201603	0B1lo0bTHuRacV2FKd0otcnczdEE	0137_03_201603	0B1lo0bTHuRacWFlGVHFQU2QzbDg									35.64467	140.1259
138	8	オープン！ちば	松島	千葉公園の大賀ハス					1						1			0138_01_201506	0B1lo0bTHuRacQjdKclpYdjNIbTA	0138_02_201506	0B1lo0bTHuRaccFJsaWc1LU5EYm8	0138_03_201506	0B1lo0bTHuRacSjg0RnNMV3JFNTA									35.618554	140.116857
139	8	オープン！ちば	松島	千葉公園綿打池の桜											1			0139_01_201504	0B1lo0bTHuRacMThWdDZ4NGVpSmc	0139_02_201504	0B1lo0bTHuRaca053NGN4SjVFS2s	0139_03_201504	0B1lo0bTHuRacMll6QmVxVnpyc1k									35.617485	140.117415
140	8	オープン！ちば	松島	花島公園の桜											1			0140_01_201503	0B1lo0bTHuRacNnNnZlFvYTRXOGs	0140_02_201503	0B1lo0bTHuRacN2F1WXNITG9CMWM											35.684153	140.09931
141	8	オープン！ちば	松島	いなげの浜の海水浴											1			0141_01_201508	0B1lo0bTHuRacVFF2MzNfb0Z3Uk0	0141_02_201508	0B1lo0bTHuRacUDlJSG9ic19hR2M											35.615006	140.064044
142	8	オープン！ちば	松島	千葉寺		"市内最古の寺院で、縁起では元明天皇の和銅2年（709）の建立と伝えられています。昭和5年から27年までの間に5回の発掘調査が行われ、奈良時代末期に4間×4間の瓦葺きの金堂が存在したことがわかっています。また旧寺域も70間（126m）四方との推定もされました。出土品には軒丸瓦、経筒、合子、和鏡など貴重なものが数多くあります。
境内の県指定天然記念物の公孫樹や「布施丹後君遺徳之碑」などの文化財が散在しています。
昭和34年市指定史跡（出典：千葉市教育委員会「市内文化財一覧」）"				1					1			0142_01_201512	0B1lo0bTHuRacRVNQTVBfVFduMFE	0142_02_201512	0B1lo0bTHuRacbk80dnVmSFhaU3M	0142_03_201512	0B1lo0bTHuRacenQ2QnVhTFVMSFE									35.59483	140.1318	昭和34年	1959	市指定	記念物	史跡
143	8	オープン！ちば	松島	千葉寺の大公孫樹		"千葉寺は、一般に「ちばでら」と呼ばれるが、正式には「せんようじ」という。奈良時代の僧行基の開創と伝えられる。境内からは奈良時代の特徴を示す瓦も出土しており、創建は奈良時代にさかのぼる寺院であることは間違いない。
指定されたイチョウは、境内中央の本堂手前にある。主幹は落雷や戦時中の火災によって焼失したが、現在でも樹勢は旺盛で、高さは約27m、幹周約10mに達する。イチョウは雌雄がある樹木で、このイチョウは雄株である。根元は太い根が四方にはり、下方の太い枝からは気根とか乳柱と呼ばれる根がたくさん垂れ下がってる。樹齢は不明で、寺伝によると和銅2年（709）に僧行基が千葉寺を開基した当時の植栽と云われている。
イチョウの仲間は、2億5千年以上前に世界中に繁茂していたが、その後訪れた氷河期により、他の仲間は絶滅し、原生のイチョウのみが生き残ったとされる。日本には野生種はなく、日本のイチョウは中国から渡来したものとその子孫である。
昭和10年県指定天然記念物（出典：千葉市教育委員会「市内文化財一覧」）
"									1			0143_01_201512	0B1lo0bTHuRacY2l6eUpmM2MwdVU													35.59483	140.1318	昭和10年	1935	県指定	記念物	天然記念物
144	8	オープン！ちば	松島	寒川神社						1								0144_01_201512	0B1lo0bTHuRaceGVVVkMtdThrYms	0144_02_201512	0B1lo0bTHuRacd1JwSUZjbEF4ekU	0144_03_201512	0B1lo0bTHuRacOHF0ZTIyRXJKZ3M									35.59724	140.120108
145	8	オープン！ちば	松島	白幡神社・結城稲荷神社						1								0145_01_201512	0B1lo0bTHuRacbXdFRm1ybjU1eVk	0145_02_201512	0B1lo0bTHuRacYUY3emdCWFJUZms											35.603525	140.113703
146	8	オープン！ちば	松島	千葉市郷土博物館（千葉城）	千葉市中央区亥鼻	"＜猪鼻城跡＞
千葉常胤が大椎城より猪鼻の台に居館を移したのは大治元年（1126）のことでした。以後、千葉胤直が原胤房に亡ぼされるまで13代330年の間、この猪鼻城を中心に、中世千葉の城下は東国屈指の都市として繁栄しました。現在郷土博物館のある周辺には、当時の遺構が残されています。
昭和34年市指定史跡（出典：千葉市教育委員会「市内文化財一覧」）"			1						1			0146_01_201601	0B1lo0bTHuRacQ3VGWFl0amFIckE	0146_02_201601	0B1lo0bTHuRacWEkySFIwZ0o1Mzg	0146_03_201601	0B1lo0bTHuRacRjgzbFNZUnhrN2M									35.60454	140.1273	昭和34年	1959	市指定	記念物	史跡
147	8	オープン！ちば	松島	千葉神社	千葉市中央区院内	"社伝によると千葉常重が、大椎城より猪鼻城に居館を移したときに、先祖より伝わる妙見尊をこの地に運び妙見社を建立しました。その際別当寺を北斗山金剛授寺と称し、千葉氏の守護神を安置しました。明治時代の神仏分離令により寺を廃して天御中主命を祀る千葉神社となりました。毎年8月に行われるだらだら祭は、千葉の風物詩となっています。
昭和34年市指定史跡（出典：千葉市教育委員会「市内文化財一覧」）"				1						1		0147_01_201601	0B1lo0bTHuRacTS1KUG1pTmpVWFU	0147_02_201601	0B1lo0bTHuRacR3BaZnVleWg4cTQ	0147_03_201601	0B1lo0bTHuRacQnlkLWxKenM2OVk									35.59483	140.1318	昭和34年	1959	市指定	記念物	史跡
148	8	オープン！ちば	松島	千葉ポートパーク・丘からの夕景											1			0148_01_201601	0B1lo0bTHuRacRkJOY0gwSjJNQUk	0148_02_201601	0B1lo0bTHuRacWGNzVlkzMl93bWs											35.598186	140.099498
149	8	オープン！ちば	松島	千葉ポートパーク・ビーチの夕景											1			0149_01_201601	0B1lo0bTHuRacZjNESmxhc1FibEE	0149_02_201601	0B1lo0bTHuRacajNvQVFsb3F6b0E											35.599722	140.097223
150	8	オープン！ちば	松島	栄福寺の枝垂桜		"栄福寺は千葉氏ゆかりの寺院である。中世に房総各地に威勢を誇っていた千葉氏は、妙見菩薩を篤く信仰していた。県内には、その崇敬ぶりをうかがわせる妙見菩薩像がいくつか残されているが、栄福寺が所蔵している「紙本著色千葉妙見大縁起絵巻」は、絵巻ではこれが唯一の資料である。
この絵巻は、千葉氏一族が守護神とした妙見菩薩との出会いから、幾多の戦いに妙見の霊験で勝利したこと、そして千葉氏の居城内への遷座といった、妙見に対する信仰の由来を、余白を多く用いて人物や建物を淡泊に表現する画法の絵と詞書で記述した、全4巻の総長約32mにおよぶ大作である。
絵巻の奥書から、享禄元年（1528）に本庄伊豆守胤村が詞書を作らせ、その後天文19年（1550）に詞書と絵を合せて上・下二巻の絵巻として作り直し、延宝6年（1678）板倉筑後守重直が補修をおこなっていることや、詞書はそれまでのものを用いて、絵は狩野探幽の門弟片山三清守長に描かせたものであることなどがわかる。
平成5年県指定有形文化財・絵画（出典：千葉市教育委員会「市内文化財一覧」）
"				1					1			0150_01_201603	0B1lo0bTHuRacWXdqNTJhMUdEVEE	0150_02_201603	0B1lo0bTHuRacU3l3M3dHZktsWUU											35.594653	140.170984
151	8	オープン！ちば	松島	旧検見川無線送信所					1				1			1		0151_01_201009	0B1lo0bTHuRacMDNNOTZvS0lIQTQ													35.646188	140.074237
152
153
154
155
156																																						
